{
  "$schema": "./config.schema.json",
  "defaultProvider": "minimax",
  "models": {
    "minimax": {
      "demoModel": "music-cover",
      "fullModel": "music-2.6",
      "allowPaidModels": true
    },
    "mureka": {
      "demoModel": "auto",
      "fullModel": "auto",
      "allowPaidModels": false
    }
  },
  "limits": {
    "minRecordingSeconds": 6,
    "maxRecordingSeconds": 60,
    "demoTargetSeconds": 30,
    "fullSongMinSeconds": 120,
    "fullSongMaxSeconds": 240,
    "dailyDemoJobsPerUser": 0,
    "dailyExtendJobsPerUser": 100,
    "refundQuotaOnProviderFailure": true
  },
  "storage": {
    "provider": "cos",
    "recordingRetention": "permanent",
    "songRetention": "permanent",
    "signedUrlTtlSeconds": 900
  },
  "features": {
    "enableExtendSong": true,
    "enableApproximateMinimaxExtend": false,
    "enableCommercialUseGate": false
  },
  "options": {
    "styles": [
      "流行",
      "抒情",
      "民谣",
      "R&B",
      "摇滚",
      "电子",
      "古风"
    ],
    "moods": [
      "温暖",
      "治愈",
      "忧伤",
      "热血",
      "浪漫",
      "梦幻"
    ],
    "languages": [
      {
        "label": "自动",
        "value": "auto"
      },
      {
        "label": "中文",
        "value": "zh"
      },
      {
        "label": "英文",
        "value": "en"
      }
    ],
    "genders": [
      {
        "label": "自动",
        "value": "auto"
      },
      {
        "label": "女声",
        "value": "female"
      },
      {
        "label": "男声",
        "value": "male"
      },
      {
        "label": "混合",
        "value": "mixed"
      }
    ]
  }
}
